{
    "nombre": "Robot aspiradora",
    "marca": "CleanTech",
    "precio": 249.99,
    "descripcion": "Robot aspiradora inteligente con mapeo de habitaciones y control remoto.",
    "disponible": true,
    "dimensiones": {
      "alto": 30,
      "ancho": 30,
      "profundidad": 10
    },
    "caracteristicas": ["Mapeo inteligente", "Succi√≥n potente", "Control remoto"]
  }
  